{
  "$schema": "http://json-schema.org/schema#",
  "type": "object",
  "properties": {
    "uuid": {
      "type": "string"
    },
    "ai_project_name": {
      "type": "string"
    },
    "type": {
      "type": "null"
    },
    "display_name": {
      "type": "null"
    },
    "description": {
      "type": "string"
    },
    "version": {
      "type": "null"
    },
    "last_update_time": {
      "type": "string"
    },
    "creation_time": {
      "type": "string"
    },
    "project_owner_uuid": {
      "type": "string"
    },
    "models": {
      "type": "array",
      "items": {
        "type": "object",
        "properties": {
          "uuid": {
            "type": "string"
          },
          "name": {
            "type": "string"
          },
          "dataset": {
            "type": "object",
            "properties": {
              "name": {
                "type": "string"
              },
              "dataset_id": {
                "type": "string"
              }
            },
            "required": [
              "dataset_id",
              "name"
            ]
          },
          "metadata": {
            "type": "object",
            "properties": {
              "type": {
                "type": "string"
              },
              "classes": {
                "type": "array",
                "items": {
                  "type": "string"
                }
              }
            },
            "required": [
              "classes",
              "type"
            ]
          },
          "target": {
            "type": "object",
            "properties": {
              "type": {
                "type": "string"
              },
              "component": {
                "type": "string"
              },
              "device": {
                "type": "string"
              }
            },
            "required": [
              "component",
              "device",
              "type"
            ]
          },
          "creation_time": {
            "type": "string"
          },
          "last_update_time": {
            "type": "string"
          },
          "model_owner_uuid": {
            "type": "string"
          },
          "training": {
            "type": "object",
            "properties": {
              "runtime": {
                "type": "object",
                "properties": {
                  "type": {
                    "type": "string"
                  },
                  "jobs": {
                    "type": "array",
                    "items": {
                      "type": "object",
                      "properties": {
                        "name": {
                          "type": "string"
                        },
                        "version": {
                          "type": "null"
                        },
                        "template_id": {
                          "type": "string"
                        }
                      },
                      "required": [
                        "name",
                        "template_id",
                        "version"
                      ]
                    }
                  }
                },
                "required": [
                  "jobs",
                  "type"
                ]
              },
              "configuration": {
                "type": "string"
              },
              "reports": {
                "type": "array",
                "items": {
                  "type": "string"
                }
              },
              "artifacts": {
                "type": "array",
                "items": {
                  "type": "string"
                }
              },
              "last_update_time": {
                "type": "string"
              },
              "creation_time": {
                "type": "string"
              }
            },
            "required": [
              "artifacts",
              "configuration",
              "creation_time",
              "last_update_time",
              "reports",
              "runtime"
            ]
          }
        },
        "required": [
          "creation_time",
          "dataset",
          "last_update_time",
          "metadata",
          "model_owner_uuid",
          "name",
          "target",
          "uuid"
        ]
      }
    },
    "deployments": {
      "type": "array"
    },
    "applications": {
      "type": "array"
    }
  },
  "required": [
    "ai_project_name",
    "applications",
    "creation_time",
    "deployments",
    "description",
    "display_name",
    "last_update_time",
    "models",
    "project_owner_uuid",
    "type",
    "uuid",
    "version"
  ]
}